title,company,location,link
Senior Software Engineer - Fullstack Python / React,StyleSeat,No office location,https://stackoverflow.com/jobs/451027
Python Developer,MUFG Investor Services FinTech LimitedviaWork in Lithuania,"Vilnius, Lithuania",https://stackoverflow.com/jobs/451385
"Python/Django Developer, Lausanne",MoneyPark,"Lausanne, Switzerland",https://stackoverflow.com/jobs/443600
Python Software Engineer,bloomon,"Amsterdam, Netherlands",https://stackoverflow.com/jobs/286140
Python Software Developer,"Old Mission Capital, LLC","Chicago, IL",https://stackoverflow.com/jobs/237203
Senior Software Engineer - Python,YouGov,"Warsaw, Poland",https://stackoverflow.com/jobs/422635
Mid-level Python and Django software developer,Eligible.ai,"London, UK",https://stackoverflow.com/jobs/447951
Senior Backend Software Engineer (Python/Django),Chaturbate,"Los Angeles, CA",https://stackoverflow.com/jobs/448419
Experienced Full-Stack Engineer (Python/Django),CareSolace Inc.,"Encinitas, CA",https://stackoverflow.com/jobs/452576
Vice President - Software Engineering (Python),"JPMorgan Chase Bank, N.A.","Hyderabad, India",https://stackoverflow.com/jobs/445610
Independent & Self-motivated Python Backend Developer,Seez,No office location,https://stackoverflow.com/jobs/394457
Mid-Level Backend Software Engineer (Python / Django),"Tivix, Inc.","Wrocław, Poland",https://stackoverflow.com/jobs/420639
Senior Full-stack web developer - Python,CBOE Global MarketsviaHays plc,"London, UK",https://stackoverflow.com/jobs/355023
Backend Developer – Python/Django,5 Monkeys Agency AB,"Stockholm, Sweden",https://stackoverflow.com/jobs/443604
Senior Backend Engineer (Python/Django),Financial Technology Partners,"San Francisco, CA",https://stackoverflow.com/jobs/446918
Backend Developer – Python/Django,5 Monkeys Agency AB,"Göteborg, Sweden",https://stackoverflow.com/jobs/443603
Senior Python Back End Engineer (Remote),Loadsmart,No office location,https://stackoverflow.com/jobs/430974
senior python developer,HaysviaHays plc,"London, UK",https://stackoverflow.com/jobs/387197
Backend Software Engineer (Python),Finsera,No office location,https://stackoverflow.com/jobs/359294
Senior Python Developer,YouGov,"Bengaluru, India",https://stackoverflow.com/jobs/400054
Python Software Engineer,Captivation Software,"Fort Meade, MD",https://stackoverflow.com/jobs/449506
Senior Python Engineer,Tivix,"Wrocław, Poland",https://stackoverflow.com/jobs/420641
Senior Full Stack Software Engineer – Python/JavaScript (m/f/d),CeleraOne GmbH,"Berlin, Deutschland",https://stackoverflow.com/jobs/449456
Python Software Engineer (40h/wk),Channable,"Utrecht, Netherlands",https://stackoverflow.com/jobs/265091
Software Developer (Java / Javascript / Python) - progress to SDET,Nominet,"Oxford, UK",https://stackoverflow.com/jobs/445445
Software Engineer - Python,"JPMorgan Chase Bank, N.A.","Glasgow, UK",https://stackoverflow.com/jobs/447637
Senior Python Engineer,Bulb Energy,"London, UK",https://stackoverflow.com/jobs/396265
Python Software Engineer (40h/wk),Channable,"Utrecht, Netherlands",https://stackoverflow.com/jobs/265091
Software Engineer-Python,"JPMorgan Chase Bank, N.A.","Mumbai, India",https://stackoverflow.com/jobs/443210
Senior Python Engineer for Booking Backend Tribe,Kiwi.com,"Prague, Czechia",https://stackoverflow.com/jobs/410394
Senior Full Stack Web Software Engineer (React & Java/Python/Node.js),"JPMorgan Chase Bank, N.A.","Houston, TX",https://stackoverflow.com/jobs/452420
Senior Backend Engineer - Python,APNATIME TECH PRIVATE LIMITED,No office location,https://stackoverflow.com/jobs/411044
"Senior Backend Software Engineer / Java, Scala, GoLang, Python",Omio,"Berlin, Germany",https://stackoverflow.com/jobs/447394
Senior Full Stack Software Engineer – Python/JavaScript (m/f/d),CeleraOne GmbH,"Berlin, Deutschland",https://stackoverflow.com/jobs/449456
Backend Engineer - Python (m/f/d),Laya Technologies,"München, Deutschland",https://stackoverflow.com/jobs/333801
Senior Python Backend Developer (m/f/x),Innoactive GmbH,"München, Germany",https://stackoverflow.com/jobs/412785
(Senior) Full-Stack Software Engineer who loves Python,Advertima,"Berlin, Germany",https://stackoverflow.com/jobs/422932
Sr. Python Software Engineer,Global Reach Consulting LLC,"Reston, VA",https://stackoverflow.com/jobs/417839
Software Developer (Java / Javascript / Python) - progress to SDET,Nominet,"Oxford, UK",https://stackoverflow.com/jobs/445445
Senior Backend Software Engineer (Python),"Curative, Inc",No office location,https://stackoverflow.com/jobs/408170
Python Developer,De La Rue North America Holdings,"Logan, UT",https://stackoverflow.com/jobs/431392
Python/Django Software Developer (m/f/d),ClimatePartner,"München, Deutschland",https://stackoverflow.com/jobs/361172
Senior Software Engineer (GO/PHP/Python/JS),Thycotic,No office location,https://stackoverflow.com/jobs/439763
Lead Engineer Backend / Python (m/f/x),Alasco,"München, Germany",https://stackoverflow.com/jobs/388312
Senior Python Engineer,Cover Genius,"Sydney, Australia",https://stackoverflow.com/jobs/416623
Python/AngularJS Developer,"JPMorgan Chase Bank, N.A.","Plano, TX",https://stackoverflow.com/jobs/446119
Python/ElasticSearch Developer (Remote),X-Team,No office location,https://stackoverflow.com/jobs/439738
Python Developer,Cboe Global MarketsviaHays plc,"London, UK",https://stackoverflow.com/jobs/397043
Python Developer,Flow Traders,"Amsterdam, Netherlands",https://stackoverflow.com/jobs/192630
ASML Program for Young Software Professionals (C++ and Python),ASML,"Veldhoven, Netherlands",https://stackoverflow.com/jobs/419612
Software Engineering - Python Developer,"JPMorgan Chase Bank, N.A.","Bengaluru, India",https://stackoverflow.com/jobs/454569
Python Developer,Flow Traders,"Amsterdam, Netherlands",https://stackoverflow.com/jobs/192630
Python/Django Software Developer (m/f/d),ClimatePartner,"München, Deutschland",https://stackoverflow.com/jobs/361172
Software Engineer - Python,"JPMorgan Chase Bank, N.A.","Glasgow, UK",https://stackoverflow.com/jobs/447637
ASML Program for Young Software Professionals (C++ and Python),ASML,"Veldhoven, Netherlands",https://stackoverflow.com/jobs/419612
"Software Engineering: ServiceNow, AWS & Python Developer","JPMorgan Chase Bank, N.A.","Wilmington, DE",https://stackoverflow.com/jobs/453119
Python Backend Developer / Data Engineer for Geo Applications (Munich),GAF AG,"München, Deutschland",https://stackoverflow.com/jobs/407481
Python Developer (Backend),Energyworx,"Houten, Netherlands",https://stackoverflow.com/jobs/165665
Python Web Developer (Back-end),Bright Network,"Edinburgh, UK",https://stackoverflow.com/jobs/394447
Senior Python Developer for Finance Tribe,Kiwi.com,"Prague, Czechia",https://stackoverflow.com/jobs/410395
Python Software Developer,"JPMorgan Chase Bank, N.A.","Herzliya, Israel",https://stackoverflow.com/jobs/445559
Software Engineering- Python,"JPMorgan Chase Bank, N.A.","Bournemouth, UK",https://stackoverflow.com/jobs/450985
Software Engineering - Python,"JPMorgan Chase Bank, N.A.","Glasgow, UK",https://stackoverflow.com/jobs/452851
Software Engineering - Python Developer,"JPMorgan Chase Bank, N.A.","Buenos Aires, Argentina",https://stackoverflow.com/jobs/445156
"Open Source Developer & DevOps (Python, Django, AWS, OpenStack)",OpenCraft,No office location,https://stackoverflow.com/jobs/453430
Python Software Developer for X-ray Detector Calibration (f/m/d),European XFEL,"Schenefeld, Deutschland",https://stackoverflow.com/jobs/449489
Full Stack Python Developer,GitStart,No office location,https://stackoverflow.com/jobs/441051
Python / Java Software Engineer,"JPMorgan Chase Bank, N.A.","New York, NY",https://stackoverflow.com/jobs/444136
Senior Software Engineer (C++/Python) - Collaboration Frameworks,Bloomberg LP,"London, UK",https://stackoverflow.com/jobs/449476
Python Data Engineer,BitEdgeviaHays plc,No office location,https://stackoverflow.com/jobs/420749
"Software Engineering: ServiceNow, AWS & Python Developer","JPMorgan Chase Bank, N.A.","Wilmington, DE",https://stackoverflow.com/jobs/446925
Software Engineering - Python/ Java,"JPMorgan Chase Bank, N.A.","Bengaluru, India",https://stackoverflow.com/jobs/452896
Senior Python Engineer for Booking Backend Tribe,Kiwi.com,"Bratislava, Slovakia",https://stackoverflow.com/jobs/413431
Senior Python Developer - Global Technology Infrastructure - Database Services - Vice...,"JPMorgan Chase Bank, N.A.","London, UK",https://stackoverflow.com/jobs/452480
Software Engineering - Python Developer,"JPMorgan Chase Bank, N.A.","Buenos Aires, Argentina",https://stackoverflow.com/jobs/452917
Software Engineering - Python Developer,"JPMorgan Chase Bank, N.A.","Buenos Aires, Argentina",https://stackoverflow.com/jobs/448612
"Open Source Developer & DevOps (Python, Django, AWS, OpenStack)",OpenCraft,No office location,https://stackoverflow.com/jobs/453430
Python Spark Software Engineer,"JPMorgan Chase Bank, N.A.","Newark, DE",https://stackoverflow.com/jobs/450220
Full Stack Software Engineer (Python),Family Zone,"Perth, Australia",https://stackoverflow.com/jobs/417421
Python Software Engineer,Administrate,"Beirut, Lebanon",https://stackoverflow.com/jobs/371364
Python Software Engineer,"JPMorgan Chase Bank, N.A.","Columbus, OH",https://stackoverflow.com/jobs/441449
Python Developer,YouGov,No office location,https://stackoverflow.com/jobs/407736
Software Engineer - Python/Big Data,"JPMorgan Chase Bank, N.A.","Newark, DE",https://stackoverflow.com/jobs/446937
Software Engineering - Python Developer,"JPMorgan Chase Bank, N.A.","Bengaluru, India",https://stackoverflow.com/jobs/454569
Full-Stack Python Engineer,Gorgias,"Paris, France",https://stackoverflow.com/jobs/333474
Software Developer In Test- Python/NoSQL/ETL environment,"JPMorgan Chase Bank, N.A.","Jersey City, NJ",https://stackoverflow.com/jobs/442526
Python Data Engineer,BitEdgeviaHays plc,No office location,https://stackoverflow.com/jobs/420749
"Software Engineering: ServiceNow, AWS & Python Developer","JPMorgan Chase Bank, N.A.","Wilmington, DE",https://stackoverflow.com/jobs/446925
Senior Python Developer - Global Technology Infrastructure - Database Services - Vice...,"JPMorgan Chase Bank, N.A.","London, UK",https://stackoverflow.com/jobs/452480
"Senior Software Engineer (Robotics, Python)",Righthand Robotics,"Somerville, MA",https://stackoverflow.com/jobs/445071
"Python Developer (Onsite in Paris, or Remote in France, UK, Germany)",PeopleDoc,No office location,https://stackoverflow.com/jobs/450845
Python Backend Developer (m/f/d) - Industrial Data Science and Software,Smart Steel Technologies GmbH,"Berlin, Germany",https://stackoverflow.com/jobs/334428
"Python Developer (m/f/d) Berlin, Kreuzberg Startup",Grandperspective GmbH,"Berlin, Deutschland",https://stackoverflow.com/jobs/394237
Senior Superhero Python Developer to protect the Bank from counterparty risk,Deutsche BankviaJWiderberg Inc. DBA Insight Resource Group,"New York, NY",https://stackoverflow.com/jobs/453533
"Senior Java Software Engineer with Python, Kafka experience","JPMorgan Chase Bank, N.A.","Chicago, IL",https://stackoverflow.com/jobs/447988
Java / Python Software Engineering - Core Engineering - Vice President,"JPMorgan Chase Bank, N.A.","London, UK",https://stackoverflow.com/jobs/452508
Full Stack Software Engineer: Java / Python (m/f/d),creditshelf,"Berlin, Deutschland",https://stackoverflow.com/jobs/376524
Software Engineering with Java/Python/ETL,"JPMorgan Chase Bank, N.A.","Wilmington, DE",https://stackoverflow.com/jobs/452072
Python Software Engineering Manager,Tempo,"San Francisco, CA",https://stackoverflow.com/jobs/442823
Python Developer,Anyfin AB,"Stockholm, Sweden",https://stackoverflow.com/jobs/451956
Senior Software Engineer (Python) - Corporate Technology | Valuations Control Group,"JPMorgan Chase Bank, N.A.","Lewisville, TX",https://stackoverflow.com/jobs/443051
"Site Reliability Engineer (Python, Java, Go)","JPMorgan Chase Bank, N.A.","Columbus, OH",https://stackoverflow.com/jobs/453224
Python Developer,Anyfin AB,"Stockholm, Sweden",https://stackoverflow.com/jobs/451956
Team Lead Engineering – API/Python (m/f/d),Laya Technologies,"München, Deutschland",https://stackoverflow.com/jobs/416103
Software Engineering - Python/Java,"JPMorgan Chase Bank, N.A.","Buenos Aires, Argentina",https://stackoverflow.com/jobs/447209
Senior Full Stack Software Engineer (React Python Flask),FineTune Learning,No office location,https://stackoverflow.com/jobs/400104
Senior Java/Python Software engineer,"JPMorgan Chase Bank, N.A.","New York, NY",https://stackoverflow.com/jobs/449588
Senior Full Stack Python Engineer,RippleMatch,"New York, NY",https://stackoverflow.com/jobs/348517
Java / Python Software Engineer - AWM Trading Technology - Vice President (VP),"JPMorgan Chase Bank, N.A.","London, UK",https://stackoverflow.com/jobs/446663
Python/Java Infrastucture Development,"JPMorgan Chase Bank, N.A.","Plano, TX",https://stackoverflow.com/jobs/444114
Senior Software Engineer - Python,DIGARC,No office location,https://stackoverflow.com/jobs/425402
Software Engineer (Python Data Stack) (m/f/d),QuantCo,"Karlsruhe, Germany",https://stackoverflow.com/jobs/349976
Data Services Software Engineer (Java & Python),IMC Trading,"Amsterdam, Netherlands",https://stackoverflow.com/jobs/447287
Senior Python Developer,Mahisoft Inc,No office location,https://stackoverflow.com/jobs/453721
Python / Java / Quant Software Engineer,"JPMorgan Chase Bank, N.A.","Jersey City, NJ",https://stackoverflow.com/jobs/446105
Software Engineering - Python - Bengaluru,"JPMorgan Chase Bank, N.A.","Bengaluru, India",https://stackoverflow.com/jobs/453654
"Senior software engineer (Typescript, Nextjs, Python, Docker/k8s, Kafka, SQL)",EverQuote Inc.,No office location,https://stackoverflow.com/jobs/385234
"Site Reliability Engineer (Python, Java, Go)","JPMorgan Chase Bank, N.A.","Columbus, OH",https://stackoverflow.com/jobs/450894
"Software Engineer with Java, C# or Python and Kafka","JPMorgan Chase Bank, N.A.","Chicago, IL",https://stackoverflow.com/jobs/444026
"Machine Learning,  Senior Python Engineer","JPMorgan Chase Bank, N.A.","Columbus, OH",https://stackoverflow.com/jobs/450448
Python Full Stack Developer,"JPMorgan Chase Bank, N.A.","Hyderabad, India",https://stackoverflow.com/jobs/448752
VP Python Software Engineer - FX Services Technology,"JPMorgan Chase Bank, N.A.","London, UK",https://stackoverflow.com/jobs/451022
Python Engineer for Ancillaries Tribe,Kiwi.com,"Brno, Czechia",https://stackoverflow.com/jobs/451951
Full Stack Engineer - Python/JS (d/f/m),Stylight,"München, Deutschland",https://stackoverflow.com/jobs/416801
"Site Reliability Engineer (Python, Java, Go)","JPMorgan Chase Bank, N.A.","Columbus, OH",https://stackoverflow.com/jobs/447064
Python Software Engineer - Macro Investable Indices - Vice President (VP),"JPMorgan Chase Bank, N.A.","London, UK",https://stackoverflow.com/jobs/450465
Python Full Stack Developer,"JPMorgan Chase Bank, N.A.","Hyderabad, India",https://stackoverflow.com/jobs/448752
Python Developer,JP Morgan Chase,"Herzliya, Israel",https://stackoverflow.com/jobs/445023
VP Python Software Engineer - FX Services Technology,"JPMorgan Chase Bank, N.A.","London, UK",https://stackoverflow.com/jobs/451022
Full Stack Python Engineer,kwalee Ltd,"Bengaluru, India",https://stackoverflow.com/jobs/415702
"Software Engineer, Associate (Python)- Treasury and CIO Risk Technology","JPMorgan Chase Bank, N.A.","Lewisville, TX",https://stackoverflow.com/jobs/448643
Full Stack Engineer - Python/JS (d/f/m),Stylight,"München, Deutschland",https://stackoverflow.com/jobs/416801
Python Engineer,Overloop,No office location,https://stackoverflow.com/jobs/450352
"Data Engineer (Java, Python, AWS)",Ascend Group,"Khwaeng Bang Chak, Thailand",https://stackoverflow.com/jobs/340997
"Experienced Python Developer - Fully Remote - Talented, Friendly Team",ShipHero,No office location,https://stackoverflow.com/jobs/358001
"Senior Developer - ""Kubernetes, Go Lang, Python,  API""",SAP,"Bengaluru, India",https://stackoverflow.com/jobs/454627
Mid Python Developer,OpsTalent,"Wrocław, Poland",https://stackoverflow.com/jobs/450822
Platform Engineer - Python or Go,HaysviaHays plc,"Raleigh, NC",https://stackoverflow.com/jobs/363246
Python Back End Engineer,Tempo,"San Francisco, CA",https://stackoverflow.com/jobs/442822
"Python Software Engineer - Commodities - Front Office Athena, VP","JPMorgan Chase Bank, N.A.",Singapore,https://stackoverflow.com/jobs/442436
Senior Python developer,Hays London City CheapsideviaHays PLC,"London, UK",https://stackoverflow.com/jobs/433870
Python Developer- AWS,HaysviaHays plc,"Tampa, FL",https://stackoverflow.com/jobs/347598
Architect and Hand-On Developer (Python/Java),"JPMorgan Chase Bank, N.A.","Plano, TX",https://stackoverflow.com/jobs/454489
"Senior Data Engineer (Python, Kafka, Airflow)",AMBOSS,"Berlin, Germany",https://stackoverflow.com/jobs/415218
Senior Back End Engineer - Java / Kotlin / Python,teckro,"Dublin, Ireland",https://stackoverflow.com/jobs/403329
Sr. Engineering Developer (Python / Go / Ruby) - Remote,HaysviaHays plc,"Atlanta, GA",https://stackoverflow.com/jobs/377138
Python Engineer,"TileDB, Inc.","Cambridge, MA",https://stackoverflow.com/jobs/419347
Cloud Java/Python Software Engineer,"JPMorgan Chase Bank, N.A.","Jersey City, NJ",https://stackoverflow.com/jobs/444630
"Technical Support Engineer (Java, Python)",DOCOMO Digital,"Madrid, Spain",https://stackoverflow.com/jobs/451416
Python Engineer (m/f/d),Matmatch GmbH,"München, Deutschland",https://stackoverflow.com/jobs/442994
Python Engineer,Market America / Shop.com,No office location,https://stackoverflow.com/jobs/431385
Python Engineer (m/f/d),e-bot7 GmbH,"München, Germany",https://stackoverflow.com/jobs/375389
Senior Python Dev for Open Source Dev Tools,"Iterative, Inc",No office location,https://stackoverflow.com/jobs/446359
Senior Python Engineer,Hummingbot,No office location,https://stackoverflow.com/jobs/440503
Java / Python Software Engineer - Commodities eTrading - Team Lead - Vice President (VP),"JPMorgan Chase Bank, N.A.","London, UK",https://stackoverflow.com/jobs/446207
Platform Engineer - Python or Go,HaysviaHays plc,"Raleigh, NC",https://stackoverflow.com/jobs/363246
BigData with Spark & Scala/Python/Java,"JPMorgan Chase Bank, N.A.","Hyderabad, India",https://stackoverflow.com/jobs/449615
BigData with Spark & Scala/Python/Java,"JPMorgan Chase Bank, N.A.","Bengaluru, India",https://stackoverflow.com/jobs/444637
Architect and Hand-On Developer (Python/Java),"JPMorgan Chase Bank, N.A.","Plano, TX",https://stackoverflow.com/jobs/454489
"DevOps Engineer (AWS, Pivotal, Python, Java)",buildit,"Kraków, Poland",https://stackoverflow.com/jobs/298627
Sr. Engineering Developer (Python / Go / Ruby) - Remote,HaysviaHays plc,"Atlanta, GA",https://stackoverflow.com/jobs/377138
Python Solutions Architect,REPAY,"Tempe, AZ",https://stackoverflow.com/jobs/406907
"Infrastructure Development-C#, Python, PowerShell or Java","JPMorgan Chase Bank, N.A.","Columbus, OH",https://stackoverflow.com/jobs/452040
Vice President -Software Engineering-Python Development,"JPMorgan Chase Bank, N.A.","Bengaluru, India",https://stackoverflow.com/jobs/442249
Lead Python Engineer (m/f/d),byrd technologies GmbH,"Berlin, Germany",https://stackoverflow.com/jobs/447381
Senior Python Developer - Quick Commerce (f/m/d),Delivery Hero SE,"Berlin, Germany",https://stackoverflow.com/jobs/450784
"Cryptography/Cryptographic Engineer - C, C++, Matlab & Python",AngokaviaHays plc,"London, UK",https://stackoverflow.com/jobs/424548
Advanced Python Engineer,Research Affiliates (Investment Systems),"Newport Beach, CA",https://stackoverflow.com/jobs/159863
Software Engineers - Cloud Reliability & Infrastructure (Python or Java),Canva,"Sydney, Australia",https://stackoverflow.com/jobs/373689
"Senior Python Engineer, Features",ReCharge Payments,No office location,https://stackoverflow.com/jobs/446791
(Senior) Python Data Engineer - Marketing Tech (f/m/d),Delivery Hero SE,"Berlin, Germany",https://stackoverflow.com/jobs/452393
Python Developer Test (m/w/d),1&1 IONOS SE,"Berlin, Deutschland",https://stackoverflow.com/jobs/405856
Java & Python Engineer (m/f/d),Synfioo GmbH,"Potsdam, Germany",https://stackoverflow.com/jobs/406851
Python/C++ DevOps Engineer,ADLARES GmbH,"Teltow, Deutschland",https://stackoverflow.com/jobs/441796
Tech Lead-BigData with Spark & Scala/Python,"JPMorgan Chase Bank, N.A.","Bengaluru, India",https://stackoverflow.com/jobs/446226
Platform Services Integration Engineering - Golang / Python - Vice President,"JPMorgan Chase Bank, N.A.","London, UK",https://stackoverflow.com/jobs/445541
Sr. Engineer - Python Dev (Remote),"CrowdStrike, Inc.","Bucharest, Romania",https://stackoverflow.com/jobs/437549
"Information Security Engineer (Python, Javascript)",Yelp,"London, UK",https://stackoverflow.com/jobs/141429
Advanced Python Engineer,Research Affiliates (Investment Systems),"Newport Beach, CA",https://stackoverflow.com/jobs/159863
"Sr. Java or Python Full Stack Developer (5+ years, Calgary)",Blackline Safety,"Calgary, AB, Canada",https://stackoverflow.com/jobs/443240
Python Developer - AI Smartinbox (f/m/d) - for our brands GMX and WEB.DE,1&1 Mail & Media Applications SE - WEB.DE | GMX | 1&1 | mail.com,"Karlsruhe, Deutschland",https://stackoverflow.com/jobs/424960
"Senior Python Engineer, Features",ReCharge Payments,No office location,https://stackoverflow.com/jobs/446791
"Associate, Python Engineer - CCB Data Ecosystems","JPMorgan Chase Bank, N.A.","Columbus, OH",https://stackoverflow.com/jobs/449627
"Senior Python Engineer, Platform Services",ReCharge Payments,No office location,https://stackoverflow.com/jobs/446789
"Developer/Senior Developer -R&D Projects in C#, Reactjs and Python",Derivco,"Barcelona, Spain",https://stackoverflow.com/jobs/435718
Senior Python Blockchain Developer - Raiden Network,brainbot,"Berlin, Germany",https://stackoverflow.com/jobs/198297
Senior Developer Python (m/w/d),cluetec GmbH,"Karlsruhe, Deutschland",https://stackoverflow.com/jobs/358217
"Mobile DevOps Engineer ( CI/CD, Jenkins, Ansible, AWS, Python)",buildit,"Kraków, Poland",https://stackoverflow.com/jobs/427678
"Data Engineer (m/f) (SQL, Python, R, Java)",RIAG DIGITAL,"Wien, Austria",https://stackoverflow.com/jobs/376577
"Principal Cloud & DevOps Consultant (AWS, Python, DevOps)",Sourced Group Inc.,Singapore,https://stackoverflow.com/jobs/372723
Senior Data Engineer – ETL Pipelines - Python - Cybersecurity,Praetorian CybersecurityviaUplink Software Solutions,No office location,https://stackoverflow.com/jobs/421770
"Senior Back End Developers (Java, Python, C++), Cyber Security",Nominet,"Oxford, UK",https://stackoverflow.com/jobs/447955
Principal Python Software Developer,Railroad19,No office location,https://stackoverflow.com/jobs/428732
Systems Engineer - Software,"ArcherDX, Inc.","Boulder, CO",https://stackoverflow.com/jobs/448576
Senior Software Engineer - Frontend/Fullstack,Rollbar,No office location,https://stackoverflow.com/jobs/454577
"Backend Developer PHP (m/w/d) in Leipzig, Halle (Saale) oder Dresden",Relaxdays GmbH,"Leipzig, Deutschland",https://stackoverflow.com/jobs/433896
"Frontend Developer (m/w/d) in Leipzig, Halle (Saale) oder Dresden",Relaxdays GmbH,"Leipzig, Deutschland",https://stackoverflow.com/jobs/433898
Software Engineer II/III,"ArcherDX, Inc.","Boulder, CO",https://stackoverflow.com/jobs/448577
"Backend Developer C# (w/m/d) in Leipzig, Halle (Saale) oder Dresden",Relaxdays GmbH,"Leipzig, Deutschland",https://stackoverflow.com/jobs/433895
SDK/PHP Contractor,Rollbar,No office location,https://stackoverflow.com/jobs/426042
Senior Software Engineer,Apple,"Austin, TX",https://stackoverflow.com/jobs/454687
SDK/PHP Contractor,Rollbar,No office location,https://stackoverflow.com/jobs/426042
Gruppenleiter Software Engineering (m/w/d) – Automotive (Ref.Nr.:(2020-106),Philotech Group,"Taufkirchen, Deutschland",https://stackoverflow.com/jobs/397507
DevOps Engineer,Channable,"Utrecht, Netherlands",https://stackoverflow.com/jobs/399980
React Engineer,FineTune Learning,No office location,https://stackoverflow.com/jobs/431371
IT Support Admin,TrustYou,"München, Germany",https://stackoverflow.com/jobs/453522
Software Engineer - Clearance Required - Multidisciplinary,BrainGu,"Chantilly, VA",https://stackoverflow.com/jobs/267449
DevOps/SRE,"ArcherDX, Inc.","Boulder, CO",https://stackoverflow.com/jobs/448575
Software Engineer - Corporate Technology | Architecture,"JPMorgan Chase Bank, N.A.","Lewisville, TX",https://stackoverflow.com/jobs/452092
"Senior Software Engineer C++, Automotive (Ref. 2019-S-03)",Philotech Group,"Getafe, Spanien",https://stackoverflow.com/jobs/351316
"AI/ML - Research & Engineering Intern, Siri Understanding",Apple,"Beijing, China",https://stackoverflow.com/jobs/454711
"AI/ML - Research & Engineering Intern, Machine Intelligence",Apple,"Beijing, China",https://stackoverflow.com/jobs/454712
Software Engineer (Monitoring System) - Working in Japan,LINE Fukuoka,"Fukuoka, Japan",https://stackoverflow.com/jobs/273841
Senior Software Engineer,HealthJoy,"Chicago, IL",https://stackoverflow.com/jobs/454589
Senior Software Engineer,Apple,"Austin, TX",https://stackoverflow.com/jobs/410384
Senior Software Engineer,Keelvar,"Cork, Ireland",https://stackoverflow.com/jobs/446541
Software Engineer - Data Backend,Yelp,"London, UK",https://stackoverflow.com/jobs/453547
Software Engineer in Test (SDET/SET),Creative Assembly,"Horsham, UK",https://stackoverflow.com/jobs/423484
Hiring developer's for GOV.UK,Government Digital Service (GDS),"London, UK",https://stackoverflow.com/jobs/447956
Remote Full Stack Software Engineer to optimize the world of Container Shipping,Portchain,"Copenhagen, Denmark",https://stackoverflow.com/jobs/433882
Développeur Full Stack (H/F) - LIVIN’,ENGIE Digital,"Paris, France",https://stackoverflow.com/jobs/399222
